Workstream (Name),Fiscal Year,Engagement,Economy (Name),Indicator ID,Engagement Description,U.S. FAOs Addressed,Firm,Engagement (Name),Workstream,Economy,Firm (Name)
Digital Standards,FY25,['recyeMjbHskbfgqpX'],Republic of Korea,OT2,Digital standards capacity building workshop to elevate emerging technology and digitalization issues and highlight U.S. interests and innovations across digital standards.,['Economic Growth (Other)'],"['rec58Whqa8Xq4dNyX', 'recWENoRi20pqReXz', 'recUpP2wTwQJzRU34', 'recB0bX5mGOF2RHwA']",Workshop on Digital Standards: Shaping the Future of Standardization,['recO6Wye9q46CaYxb'],['rec2SfojMouQz838n'],"Boeing, Davidson Technologies, SAE Industry Technologies Consortia, Stendard "
Technical Barriers to Trade,FY25,['recjbjufeRVc2tKAJ'],Republic of Korea,OT2,,['Economic Growth (Other)'],"['recWiiNGtnqnVJopm', 'recENjvPYzBainBK6']",APEC Workshop on Technical Barriers to Trade: Recent Trends in FTAs,['recqvqMEpTfZTKevx'],['rec2SfojMouQz838n'],"Akin Gump, Ansley International Consultants"
Cloud Computing,FY25,['recuPTF8nuXgFqIX5'],Republic of Korea,OT2,,['Economic Growth (Other)'],"['recVe01W0DYKIutVg', 'recmGTTIm8KO5sC6v', 'recEeiG1Z1jE8fBUJ']",Workshop on Advancing Cloud Transformation,['rec8X4hhBa5cOnk18'],['rec2SfojMouQz838n'],"Codit, Amazon, Crowell & Moring LLP"
Free Trade Area of the Asia-Pacific,FY25,['recOnf2sxH7keZrHn'],Republic of Korea,OT2,,['Economic Growth (Other)'],"['reczCXL1bEsd8gAV0', 'recWiiNGtnqnVJopm', 'recEYHbo3kpiPFSQb']",APEC Workshop on Advancing the FTAAP: Issues Related to Rules of Origin,['reckuD4pDTWtZesJN'],['rec2SfojMouQz838n'],"American Chemistry Council, Akin Gump, United States Council for International Business "
Supply Chain Connectivity,FY25,['recoX3naiW5GDsnIX'],Republic of Korea,OT2,,['Economic Growth (Other)'],"['reczCXL1bEsd8gAV0', 'recmY02tJrdmE4Qy8']",APEC 17th A2C2 Meeting,['recj4G8RWTsTnomP6'],['rec2SfojMouQz838n'],"American Chemistry Council, Dow"
Services,FY25,['rec4Beub5QxIVTj0G'],Republic of Korea,OT2,,['Economic Growth (Other)'],,APEC Workshop on Services Technical Standards Development: The Process and Impact,['recIze3I0sDtjtxap'],['rec2SfojMouQz838n'],
Digital Trade,FY25,['recEQoIBeNaGiEj6E'],Republic of Korea,OT2,,['Economic Growth (Other)'],['recIVGTvfNrGOGf7y'],Digital Trade Policy Dialogue,['rece5twihWGNiY0bI'],['rec2SfojMouQz838n'],Coupang
